{
  "$schema": "https://json-schema.org/draft/2020-12/schema",
  "$id": "https://flai-os.local/contracts/task.schema.json",
  "title": "FLAi-OS 任务对象契约 (Task)",
  "description": "内核 Task Runner 维护的任务记录必须符合本 schema。任务是 Agent 一次调用的生命周期载体，十态状态机是 Kernel 与前端共认的唯一真相源；不得在其外私设状态字段。",
  "type": "object",
  "additionalProperties": false,
  "required": ["id", "agent_id", "agent_version", "status", "created_by", "created_at"],
  "properties": {
    "id": { "type": "string", "minLength": 1, "description": "任务全局唯一 ID（建议 UUID）。" },
    "agent_id": { "type": "string", "pattern": "^[a-z][a-z0-9_]{2,63}$", "description": "对应 agent.yaml 的 id，Registry 中必须存在。" },
    "agent_version": { "type": "string", "pattern": "^\\d+\\.\\d+\\.\\d+$", "description": "任务创建时锁定的 Agent semver；同一 Agent 升版不影响历史任务的可追溯口径。" },
    "name": {
      "type": ["string", "null"],
      "minLength": 1,
      "maxLength": 200,
      "description": "任务显示名（门户任务列表用），通常由发起人或前端默认填充；创建时未传则为 null（CreateTaskRequest.name 是可选字段），不得省略字段。"
    },
    "status": {
      "type": "string",
      "enum": [
        "created", "queued", "validating", "running", "waiting_review",
        "parsing", "analyzing", "completed", "failed", "cancelled"
      ],
      "description": "十态状态机，仅 Kernel Task Runner 可写。waiting_review 对应 agent.yaml workflow.requires_human_review=true 的强制人工放行点；completed 只能从 waiting_review 或 analyzing 迁入，不得跳过人工判决。"
    },
    "created_by": { "type": "string", "minLength": 1, "description": "发起用户/角色标识，对齐 agent.yaml permissions.allowed_roles 的鉴权主体。" },
    "created_at": { "type": "string", "format": "date-time", "description": "ISO 8601 时间戳。" },
    "updated_at": { "type": "string", "format": "date-time", "description": "状态最近一次变更时间；每次状态迁移必须同步刷新。" },
    "started_at": {
      "type": ["string", "null"],
      "format": "date-time",
      "description": "进入 running 的时间戳；running 之前为 null，不得省略字段。"
    },
    "finished_at": {
      "type": ["string", "null"],
      "format": "date-time",
      "description": "进入终态（completed/failed/cancelled）的时间戳；未结束为 null，绝不省略字段。"
    },
    "input_file_ids": {
      "type": "array",
      "items": { "type": "string", "minLength": 1 },
      "uniqueItems": true,
      "description": "输入文件 ID 列表（File Store 主键），对应 agent.yaml input.type=file_upload 场景。"
    },
    "output_file_ids": {
      "type": "array",
      "items": { "type": "string", "minLength": 1 },
      "uniqueItems": true,
      "description": "输出文件 ID 列表；未产出前为空数组，不得用 null 代替。"
    },
    "error_message": {
      "type": ["string", "null"],
      "description": "失败原因摘要（status=failed 时必填非 null）；未失败时为 null。禁止塞入未脱敏的原始堆栈——脱敏后的可读摘要，原始堆栈走 Event 的 payload。"
    },
    "inputs": {
      "type": "object",
      "description": "params 型任务的结构化输入（经 agent input_schema.json 校验）；file_upload 型任务此字段可为空对象，输入走 input_file_ids。"
    },
    "metadata": {
      "type": "object",
      "description": "扩展元数据（自由 key-value，如触发来源、优先级标签）。不得借此绕过契约字段——新增结构化字段须先修订本 schema。"
    },
    "conversation_id": {
      "type": ["string", "null"],
      "description": "归属的导引协作会话 id（M8/ADR-0016）：由导引编排官分流产出的任务记会话 id，供协作工作台按会话聚合；门户直建任务为 null。仅分组归属，不改执行语义。"
    },
    "origin": {
      "type": "string",
      "enum": ["user", "eval"],
      "description": "任务来源（M10/ADR-0018）：user=用户任务（worker 候选集）/eval=评测跑批任务（仅 eval runner 驱动，不落样本、不进默认任务流视图）。两执行方候选集不相交，双跑竞态在结构上不存在。"
    },
    "data_classification": {
      "type": ["string", "null"],
      "enum": ["internal", "sensitive", null],
      "description": "不可变任务级派生分级（迁移 #8/ADR-0025）：执行期算一次（文件∨知识∨工具三轴）落库，read 门只读此列不重派生（抗工具卸载漂移，Codex R1-B）。null=未分级（未跑任务/存量未回填），read 门兜底 fail-closed。"
    },
    "content_withheld": {
      "type": "boolean",
      "description": "本响应的内容承载字段（error_message 等）已因任务分级=sensitive 遮蔽（ADR-0025 单 chokepoint）。仅在 sensitive 任务响应上出现；元数据仍完整。"
    },
    "depends_on": {
      "type": "array",
      "items": { "type": "string", "minLength": 1 },
      "description": "声明式任务依赖（迁移 #9/协作运行时 §3.1）：本任务依赖的上游 task_id 列表。非空时任务滞留 created，由 resolver 在全部上游 completed（review-gated 上游必经人签）后，管道上游产物入 input_file_ids 并 created→queued。空数组=无依赖（门户直建任务）。建时冻结、只引已存在任务 → 图按构造即 DAG。"
    },
    "input_binding": {
      "type": ["object", "null"],
      "description": "artifact→input 绑定（迁移 #9/协作运行时 §3.1）：声明上游产物如何映射为本任务输入。字段 from_tasks（string 数组，创建期 typed+有界≤32+去重）：非空=resolver 只从这些上游拷 output_file_ids 入 input_file_ids，其余上游仍参与依赖等待但产物不注入；空数组或 null=默认拷全部上游 output_file_ids。from_tasks 引用的上游必在 depends_on 内（越权引用创建期 422 拒）。"
    }
  }
}
